Sheet: underwater_failure_tube_v_raw
A2: Key Images
A3: Name | B3: Time
A4: 0.00 | B4: 400
A5: 433 ms | B5: 433
A7: Lines
A8: Name | B8: Length (cm) | C8: Time
A9: Line 1 | B9: 1 | C9: 400
A11: Stopwatches
A12: Label | B12: Duration | C12: Start | D12: Stop
A13: Time | B13: 17500 | C13: 400 | D13: 17900
A15: Track
A16: Label : | B16: pos_red
A17: Coords (x,y:cm; t:time)
A18: x | B18: y | C18: t
A19: 0 | B19: 0 | C19: 58433 | D19: =RC[-1]-58433 -> 0
A20: 0 | B20: 0 | C20: 58467 | D20: =RC[-1]-58433 -> 34
A21: 0 | B21: 0 | C21: 58500 | D21: =RC[-1]-58433 -> 67
A22: 0 | B22: 0 | C22: 58533 | D22: =RC[-1]-58433 -> 100
A23: 0 | B23: 0 | C23: 58567 | D23: =RC[-1]-58433 -> 134
A24: 0 | B24: 0 | C24: 58600 | D24: =RC[-1]-58433 -> 167
A25: 0 | B25: 0 | C25: 58633 | D25: =RC[-1]-58433 -> 200
A26: 0 | B26: 0 | C26: 58667 | D26: =RC[-1]-58433 -> 234
A27: 0 | B27: 0 | C27: 58700 | D27: =RC[-1]-58433 -> 267
A28: 0 | B28: 0 | C28: 58733 | D28: =RC[-1]-58433 -> 300
A29: 0 | B29: 0 | C29: 58767 | D29: =RC[-1]-58433 -> 334
A30: 0 | B30: 0 | C30: 58800 | D30: =RC[-1]-58433 -> 367
A31: 0 | B31: 0 | C31: 58833 | D31: =RC[-1]-58433 -> 400
A32: 0 | B32: 0 | C32: 58867 | D32: =RC[-1]-58433 -> 434
A33: 0 | B33: 0 | C33: 58900 | D33: =RC[-1]-58433 -> 467
A34: 0 | B34: 0 | C34: 58933 | D34: =RC[-1]-58433 -> 500
A35: 0 | B35: 0 | C35: 58967 | D35: =RC[-1]-58433 -> 534
A36: 0 | B36: 0 | C36: 59000 | D36: =RC[-1]-58433 -> 567
A37: 0 | B37: 0 | C37: 59033 | D37: =RC[-1]-58433 -> 600
A38: 0 | B38: 0 | C38: 59067 | D38: =RC[-1]-58433 -> 634
A39: 0 | B39: 0 | C39: 59100 | D39: =RC[-1]-58433 -> 667
A40: 0 | B40: 0 | C40: 59133 | D40: =RC[-1]-58433 -> 700
A41: 0 | B41: 0 | C41: 59167 | D41: =RC[-1]-58433 -> 734
A42: 0 | B42: 0 | C42: 59200 | D42: =RC[-1]-58433 -> 767
A43: 0 | B43: 0 | C43: 59233 | D43: =RC[-1]-58433 -> 800
A44: 0 | B44: 0 | C44: 59267 | D44: =RC[-1]-58433 -> 834
A45: 0 | B45: 0 | C45: 59300 | D45: =RC[-1]-58433 -> 867
A46: 0 | B46: 0 | C46: 59333 | D46: =RC[-1]-58433 -> 900
A47: 0 | B47: 0 | C47: 59367 | D47: =RC[-1]-58433 -> 934
A48: 0 | B48: 0 | C48: 59400 | D48: =RC[-1]-58433 -> 967
A49: 0.01 | B49: 0 | C49: 59433 | D49: =RC[-1]-58433 -> 1000
A50: 0.01 | B50: 0 | C50: 59467 | D50: =RC[-1]-58433 -> 1034
A51: 0.01 | B51: 0 | C51: 59500 | D51: =RC[-1]-58433 -> 1067
A52: 0.01 | B52: 0 | C52: 59533 | D52: =RC[-1]-58433 -> 1100
A53: 0.01 | B53: 0 | C53: 59567 | D53: =RC[-1]-58433 -> 1134
A54: 0.01 | B54: 0 | C54: 59600 | D54: =RC[-1]-58433 -> 1167
A55: 0.01 | B55: 0 | C55: 59633 | D55: =RC[-1]-58433 -> 1200
A56: 0.01 | B56: 0 | C56: 59667 | D56: =RC[-1]-58433 -> 1234
A57: 0.01 | B57: 0 | C57: 59700 | D57: =RC[-1]-58433 -> 1267
A58: 0.01 | B58: 0 | C58: 59733 | D58: =RC[-1]-58433 -> 1300
A59: 0.01 | B59: 0 | C59: 59767 | D59: =RC[-1]-58433 -> 1334
A60: 0.01 | B60: 0 | C60: 59800 | D60: =RC[-1]-58433 -> 1367
A61: -0.01 | B61: 0 | C61: 59833 | D61: =RC[-1]-58433 -> 1400
A62: -0.01 | B62: 0 | C62: 59867 | D62: =RC[-1]-58433 -> 1434
A63: -0.01 | B63: 0 | C63: 59900 | D63: =RC[-1]-58433 -> 1467
A64: -0.01 | B64: 0 | C64: 59933 | D64: =RC[-1]-58433 -> 1500
A65: -0.01 | B65: 0 | C65: 59967 | D65: =RC[-1]-58433 -> 1534
A66: -0.01 | B66: 0 | C66: 60000 | D66: =RC[-1]-58433 -> 1567
A67: 0.01 | B67: 0 | C67: 60033 | D67: =RC[-1]-58433 -> 1600
A68: 0.01 | B68: 0 | C68: 60067 | D68: =RC[-1]-58433 -> 1634
A69: 0.01 | B69: 0 | C69: 60100 | D69: =RC[-1]-58433 -> 1667
A70: 0.01 | B70: 0 | C70: 60133 | D70: =RC[-1]-58433 -> 1700
A71: 0.01 | B71: 0 | C71: 60167 | D71: =RC[-1]-58433 -> 1734
A72: 0.01 | B72: 0 | C72: 60200 | D72: =RC[-1]-58433 -> 1767
A73: 0.01 | B73: 0 | C73: 60233 | D73: =RC[-1]-58433 -> 1800
A74: 0.01 | B74: 0 | C74: 60267 | D74: =RC[-1]-58433 -> 1834
A75: 0.01 | B75: 0 | C75: 60300 | D75: =RC[-1]-58433 -> 1867
A76: 0.01 | B76: 0 | C76: 60333 | D76: =RC[-1]-58433 -> 1900
A77: 0.01 | B77: 0 | C77: 60367 | D77: =RC[-1]-58433 -> 1934
A78: 0.02 | B78: 0 | C78: 60400 | D78: =RC[-1]-58433 -> 1967
A79: 0.02 | B79: 0 | C79: 60433 | D79: =RC[-1]-58433 -> 2000
A80: 0.02 | B80: 0 | C80: 60467 | D80: =RC[-1]-58433 -> 2034
A81: 0.02 | B81: 0 | C81: 60500 | D81: =RC[-1]-58433 -> 2067
A82: 0.02 | B82: 0 | C82: 60533 | D82: =RC[-1]-58433 -> 2100
A83: 0.02 | B83: 0 | C83: 60567 | D83: =RC[-1]-58433 -> 2134
A84: 0.02 | B84: 0 | C84: 60600 | D84: =RC[-1]-58433 -> 2167
A85: 0.02 | B85: 0 | C85: 60633 | D85: =RC[-1]-58433 -> 2200
A86: 0.02 | B86: 0.01 | C86: 60667 | D86: =RC[-1]-58433 -> 2234
A87: 0.02 | B87: 0.01 | C87: 60700 | D87: =RC[-1]-58433 -> 2267
A88: 0.02 | B88: 0.01 | C88: 60733 | D88: =RC[-1]-58433 -> 2300
A89: 0.02 | B89: 0.01 | C89: 60767 | D89: =RC[-1]-58433 -> 2334
A90: 0.02 | B90: 0.01 | C90: 60800 | D90: =RC[-1]-58433 -> 2367
A91: 0.02 | B91: 0.01 | C91: 60833 | D91: =RC[-1]-58433 -> 2400
A92: 0.02 | B92: 0.01 | C92: 60867 | D92: =RC[-1]-58433 -> 2434
A93: 0.02 | B93: 0.01 | C93: 60900 | D93: =RC[-1]-58433 -> 2467
A94: 0.02 | B94: 0.01 | C94: 60933 | D94: =RC[-1]-58433 -> 2500
A95: 0.02 | B95: 0.01 | C95: 60967 | D95: =RC[-1]-58433 -> 2534
A96: 0.02 | B96: 0.01 | C96: 61000 | D96: =RC[-1]-58433 -> 2567
A97: 0.02 | B97: 0.01 | C97: 61033 | D97: =RC[-1]-58433 -> 2600
A98: 0.02 | B98: 0.01 | C98: 61067 | D98: =RC[-1]-58433 -> 2634
A99: 0.01 | B99: 0.01 | C99: 61100 | D99: =RC[-1]-58433 -> 2667
A100: 0.01 | B100: 0.01 | C100: 61133 | D100: =RC[-1]-58433 -> 2700
A101: 0.01 | B101: 0.01 | C101: 61167 | D101: =RC[-1]-58433 -> 2734
A102: 0.01 | B102: 0.01 | C102: 61200 | D102: =RC[-1]-58433 -> 2767
A103: 0.01 | B103: 0.01 | C103: 61233 | D103: =RC[-1]-58433 -> 2800
A104: 0.01 | B104: 0.01 | C104: 61267 | D104: =RC[-1]-58433 -> 2834
A105: 0.01 | B105: 0.01 | C105: 61300 | D105: =RC[-1]-58433 -> 2867
A106: 0.01 | B106: 0.01 | C106: 61333 | D106: =RC[-1]-58433 -> 2900
A107: 0.01 | B107: 0.01 | C107: 61367 | D107: =RC[-1]-58433 -> 2934
A108: 0.02 | B108: 0.01 | C108: 61400 | D108: =RC[-1]-58433 -> 2967
A109: 0.01 | B109: 0.01 | C109: 61433 | D109: =RC[-1]-58433 -> 3000
A110: 0.01 | B110: 0.01 | C110: 61467 | D110: =RC[-1]-58433 -> 3034
A111: 0.01 | B111: 0.01 | C111: 61500 | D111: =RC[-1]-58433 -> 3067
A112: 0.02 | B112: 0.01 | C112: 61533 | D112: =RC[-1]-58433 -> 3100
A113: 0.02 | B113: 0.01 | C113: 61567 | D113: =RC[-1]-58433 -> 3134
A114: 0.02 | B114: 0.01 | C114: 61600 | D114: =RC[-1]-58433 -> 3167
A115: 0.02 | B115: 0.01 | C115: 61633 | D115: =RC[-1]-58433 -> 3200
A116: 0.02 | B116: 0.01 | C116: 61667 | D116: =RC[-1]-58433 -> 3234
A117: 0.02 | B117: 0.01 | C117: 61700 | D117: =RC[-1]-58433 -> 3267
A118: 0.02 | B118: 0.01 | C118: 61733 | D118: =RC[-1]-58433 -> 3300
A119: 0.02 | B119: 0.01 | C119: 61767 | D119: =RC[-1]-58433 -> 3334
A120: 0.02 | B120: 0.01 | C120: 61800 | D120: =RC[-1]-58433 -> 3367
A121: 0.02 | B121: 0.01 | C121: 61833 | D121: =RC[-1]-58433 -> 3400
A122: 0.02 | B122: 0.01 | C122: 61867 | D122: =RC[-1]-58433 -> 3434
A123: 0.02 | B123: 0.01 | C123: 61900 | D123: =RC[-1]-58433 -> 3467
A124: 0.03 | B124: 0.01 | C124: 61933 | D124: =RC[-1]-58433 -> 3500
A125: 0.03 | B125: 0.01 | C125: 61967 | D125: =RC[-1]-58433 -> 3534
A126: 0.03 | B126: 0.01 | C126: 62000 | D126: =RC[-1]-58433 -> 3567
A127: 0.03 | B127: 0.01 | C127: 62033 | D127: =RC[-1]-58433 -> 3600
A128: 0.03 | B128: 0.01 | C128: 62067 | D128: =RC[-1]-58433 -> 3634
A129: 0.03 | B129: 0.01 | C129: 62100 | D129: =RC[-1]-58433 -> 3667
A130: 0.03 | B130: 0.01 | C130: 62133 | D130: =RC[-1]-58433 -> 3700
A131: 0.03 | B131: 0.01 | C131: 62167 | D131: =RC[-1]-58433 -> 3734
A132: 0.03 | B132: 0.01 | C132: 62200 | D132: =RC[-1]-58433 -> 3767
A133: 0.03 | B133: 0.01 | C133: 62233 | D133: =RC[-1]-58433 -> 3800
A134: 0.03 | B134: 0.01 | C134: 62267 | D134: =RC[-1]-58433 -> 3834
A135: 0.03 | B135: 0.01 | C135: 62300 | D135: =RC[-1]-58433 -> 3867
A136: 0.03 | B136: 0.01 | C136: 62333 | D136: =RC[-1]-58433 -> 3900
A137: 0.03 | B137: 0.01 | C137: 62367 | D137: =RC[-1]-58433 -> 3934
A138: 0.03 | B138: 0.01 | C138: 62400 | D138: =RC[-1]-58433 -> 3967
A139: 0.03 | B139: 0.01 | C139: 62433 | D139: =RC[-1]-58433 -> 4000
A140: 0.03 | B140: 0.01 | C140: 62467 | D140: =RC[-1]-58433 -> 4034
A141: 0.03 | B141: 0.01 | C141: 62500 | D141: =RC[-1]-58433 -> 4067
A142: 0.02 | B142: 0.01 | C142: 62533 | D142: =RC[-1]-58433 -> 4100
A143: 0.02 | B143: 0.01 | C143: 62567 | D143: =RC[-1]-58433 -> 4134
A144: 0.02 | B144: 0.02 | C144: 62600 | D144: =RC[-1]-58433 -> 4167
A145: 0.02 | B145: 0.02 | C145: 62633 | D145: =RC[-1]-58433 -> 4200
A146: 0.02 | B146: 0.02 | C146: 62667 | D146: =RC[-1]-58433 -> 4234
A147: 0.02 | B147: 0.02 | C147: 62700 | D147: =RC[-1]-58433 -> 4267
A148: 0.02 | B148: 0.02 | C148: 62733 | D148: =RC[-1]-58433 -> 4300
A149: 0.02 | B149: 0.02 | C149: 62767 | D149: =RC[-1]-58433 -> 4334
A150: 0.02 | B150: 0.02 | C150: 62800 | D150: =RC[-1]-58433 -> 4367
A151: 0.03 | B151: 0.01 | C151: 62833 | D151: =RC[-1]-58433 -> 4400
A152: 0.03 | B152: 0.01 | C152: 62867 | D152: =RC[-1]-58433 -> 4434
A153: 0.03 | B153: 0.01 | C153: 62900 | D153: =RC[-1]-58433 -> 4467
A154: 0.03 | B154: 0.01 | C154: 62933 | D154: =RC[-1]-58433 -> 4500
A155: 0.03 | B155: 0.01 | C155: 62967 | D155: =RC[-1]-58433 -> 4534
A156: 0.03 | B156: 0.01 | C156: 63000 | D156: =RC[-1]-58433 -> 4567
A157: 0.03 | B157: 0.01 | C157: 63033 | D157: =RC[-1]-58433 -> 4600
A158: 0.03 | B158: 0.01 | C158: 63067 | D158: =RC[-1]-58433 -> 4634
A159: 0.03 | B159: 0.01 | C159: 63100 | D159: =RC[-1]-58433 -> 4667
A160: 0.03 | B160: 0.01 | C160: 63133 | D160: =RC[-1]-58433 -> 4700
A161: 0.03 | B161: 0.01 | C161: 63167 | D161: =RC[-1]-58433 -> 4734
A162: 0.03 | B162: 0.01 | C162: 63200 | D162: =RC[-1]-58433 -> 4767
A163: 0.03 | B163: 0.01 | C163: 63233 | D163: =RC[-1]-58433 -> 4800
A164: 0.03 | B164: 0.01 | C164: 63267 | D164: =RC[-1]-58433 -> 4834
A165: 0.03 | B165: 0.01 | C165: 63300 | D165: =RC[-1]-58433 -> 4867
A166: 0.03 | B166: 0.02 | C166: 63333 | D166: =RC[-1]-58433 -> 4900
A167: 0.03 | B167: 0.02 | C167: 63367 | D167: =RC[-1]-58433 -> 4934
A168: 0.03 | B168: 0.02 | C168: 63400 | D168: =RC[-1]-58433 -> 4967
A169: 0.03 | B169: 0.02 | C169: 63433 | D169: =RC[-1]-58433 -> 5000
A170: 0.03 | B170: 0.02 | C170: 63467 | D170: =RC[-1]-58433 -> 5034
A171: 0.03 | B171: 0.02 | C171: 63500 | D171: =RC[-1]-58433 -> 5067
A172: 0.03 | B172: 0.02 | C172: 63533 | D172: =RC[-1]-58433 -> 5100
A173: 0.03 | B173: 0.02 | C173: 63567 | D173: =RC[-1]-58433 -> 5134
A174: 0.03 | B174: 0.02 | C174: 63600 | D174: =RC[-1]-58433 -> 5167
A175: 0.03 | B175: 0.02 | C175: 63633 | D175: =RC[-1]-58433 -> 5200
A176: 0.03 | B176: 0.02 | C176: 63667 | D176: =RC[-1]-58433 -> 5234
A177: 0.03 | B177: 0.02 | C177: 63700 | D177: =RC[-1]-58433 -> 5267
A178: 0.05 | B178: 0.01 | C178: 63733 | D178: =RC[-1]-58433 -> 5300
A179: 0.05 | B179: 0.02 | C179: 63767 | D179: =RC[-1]-58433 -> 5334
A180: 0.05 | B180: 0.02 | C180: 63800 | D180: =RC[-1]-58433 -> 5367
A181: 0.05 | B181: 0.02 | C181: 63833 | D181: =RC[-1]-58433 -> 5400
A182: 0.05 | B182: 0.02 | C182: 63867 | D182: =RC[-1]-58433 -> 5434
A183: 0.05 | B183: 0.02 | C183: 63900 | D183: =RC[-1]-58433 -> 5467
A184: 0.05 | B184: 0.02 | C184: 63933 | D184: =RC[-1]-58433 -> 5500
A185: 0.05 | B185: 0.02 | C185: 63967 | D185: =RC[-1]-58433 -> 5534
A186: 0.05 | B186: 0.02 | C186: 64000 | D186: =RC[-1]-58433 -> 5567
A187: 0.05 | B187: 0.02 | C187: 64033 | D187: =RC[-1]-58433 -> 5600
A188: 0.05 | B188: 0.02 | C188: 64067 | D188: =RC[-1]-58433 -> 5634
A189: 0.05 | B189: 0.02 | C189: 64100 | D189: =RC[-1]-58433 -> 5667
A190: 0.06 | B190: 0.02 | C190: 64133 | D190: =RC[-1]-58433 -> 5700
A191: 0.06 | B191: 0.02 | C191: 64167 | D191: =RC[-1]-58433 -> 5734
A192: 0.06 | B192: 0.02 | C192: 64200 | D192: =RC[-1]-58433 -> 5767
A193: 0.06 | B193: 0.02 | C193: 64233 | D193: =RC[-1]-58433 -> 5800
A194: 7.0000000000000007E-2 | B194: 0.02 | C194: 64267 | D194: =RC[-1]-58433 -> 5834
A195: 7.0000000000000007E-2 | B195: 0.02 | C195: 64300 | D195: =RC[-1]-58433 -> 5867
A196: 7.0000000000000007E-2 | B196: 0.02 | C196: 64333 | D196: =RC[-1]-58433 -> 5900
A197: 7.0000000000000007E-2 | B197: 0.02 | C197: 64367 | D197: =RC[-1]-58433 -> 5934
A198: 7.0000000000000007E-2 | B198: 0.02 | C198: 64400 | D198: =RC[-1]-58433 -> 5967
A199: 7.0000000000000007E-2 | B199: 0.02 | C199: 64433 | D199: =RC[-1]-58433 -> 6000
A200: 7.0000000000000007E-2 | B200: 0.02 | C200: 64467 | D200: =RC[-1]-58433 -> 6034
A201: 0.06 | B201: 0.02 | C201: 64500 | D201: =RC[-1]-58433 -> 6067
A202: 0.06 | B202: 0.02 | C202: 64533 | D202: =RC[-1]-58433 -> 6100
A203: 7.0000000000000007E-2 | B203: 0.02 | C203: 64567 | D203: =RC[-1]-58433 -> 6134
A204: 7.0000000000000007E-2 | B204: 0.02 | C204: 64600 | D204: =RC[-1]-58433 -> 6167
A205: 0.09 | B205: 0.02 | C205: 64633 | D205: =RC[-1]-58433 -> 6200
A206: 0.09 | B206: 0.02 | C206: 64667 | D206: =RC[-1]-58433 -> 6234
A207: 0.09 | B207: 0.02 | C207: 64700 | D207: =RC[-1]-58433 -> 6267
A208: 0.09 | B208: 0.02 | C208: 64733 | D208: =RC[-1]-58433 -> 6300
A209: 0.09 | B209: 0.02 | C209: 64767 | D209: =RC[-1]-58433 -> 6334
A210: 0.09 | B210: 0.02 | C210: 64800 | D210: =RC[-1]-58433 -> 6367
A211: 0.09 | B211: 0.02 | C211: 64833 | D211: =RC[-1]-58433 -> 6400
A212: 0.09 | B212: 0.02 | C212: 64867 | D212: =RC[-1]-58433 -> 6434
A213: 0.09 | B213: 0.02 | C213: 64900 | D213: =RC[-1]-58433 -> 6467
A214: 0.09 | B214: 0.02 | C214: 64933 | D214: =RC[-1]-58433 -> 6500
A215: 0.09 | B215: 0.02 | C215: 64967 | D215: =RC[-1]-58433 -> 6534
A216: 0.09 | B216: 0.02 | C216: 65000 | D216: =RC[-1]-58433 -> 6567
A217: 0.09 | B217: 0.02 | C217: 65033 | D217: =RC[-1]-58433 -> 6600
A218: 0.09 | B218: 0.02 | C218: 65067 | D218: =RC[-1]-58433 -> 6634
A219: 0.09 | B219: 0.02 | C219: 65100 | D219: =RC[-1]-58433 -> 6667
A220: 0.09 | B220: 0.02 | C220: 65133 | D220: =RC[-1]-58433 -> 6700
A221: 0.09 | B221: 0.02 | C221: 65167 | D221: =RC[-1]-58433 -> 6734
A222: 0.09 | B222: 0.02 | C222: 65200 | D222: =RC[-1]-58433 -> 6767
A223: 0.09 | B223: 0.02 | C223: 65233 | D223: =RC[-1]-58433 -> 6800
A224: 0.09 | B224: 0.02 | C224: 65267 | D224: =RC[-1]-58433 -> 6834
A225: 0.09 | B225: 0.02 | C225: 65300 | D225: =RC[-1]-58433 -> 6867
A226: 0.09 | B226: 0.04 | C226: 65333 | D226: =RC[-1]-58433 -> 6900
A227: 0.09 | B227: 0.04 | C227: 65367 | D227: =RC[-1]-58433 -> 6934
A228: 7.0000000000000007E-2 | B228: 0.04 | C228: 65400 | D228: =RC[-1]-58433 -> 6967
A229: 7.0000000000000007E-2 | B229: 0.04 | C229: 65433 | D229: =RC[-1]-58433 -> 7000
A230: 0.09 | B230: 0.02 | C230: 65467 | D230: =RC[-1]-58433 -> 7034
A231: 0.09 | B231: 0.02 | C231: 65500 | D231: =RC[-1]-58433 -> 7067
A232: 0.09 | B232: 0.02 | C232: 65533 | D232: =RC[-1]-58433 -> 7100
A233: 0.1 | B233: 0.02 | C233: 65567 | D233: =RC[-1]-58433 -> 7134
A234: 0.1 | B234: 0.02 | C234: 65600 | D234: =RC[-1]-58433 -> 7167
A235: 0.1 | B235: 0.02 | C235: 65633 | D235: =RC[-1]-58433 -> 7200
A236: 0.1 | B236: 0.02 | C236: 65667 | D236: =RC[-1]-58433 -> 7234
A237: 0.1 | B237: 0.02 | C237: 65700 | D237: =RC[-1]-58433 -> 7267
A238: 0.1 | B238: 0.04 | C238: 65733 | D238: =RC[-1]-58433 -> 7300
A239: 0.1 | B239: 0.04 | C239: 65767 | D239: =RC[-1]-58433 -> 7334
A240: 0.1 | B240: 0.04 | C240: 65800 | D240: =RC[-1]-58433 -> 7367
A241: 0.1 | B241: 0.04 | C241: 65833 | D241: =RC[-1]-58433 -> 7400
A242: 0.1 | B242: 0.04 | C242: 65867 | D242: =RC[-1]-58433 -> 7434
A243: 0.1 | B243: 0.02 | C243: 65900 | D243: =RC[-1]-58433 -> 7467
A244: 0.11 | B244: 0.02 | C244: 65933 | D244: =RC[-1]-58433 -> 7500
A245: 0.11 | B245: 0.04 | C245: 65967 | D245: =RC[-1]-58433 -> 7534
A246: 0.11 | B246: 0.04 | C246: 66000 | D246: =RC[-1]-58433 -> 7567
A247: 0.11 | B247: 0.04 | C247: 66033 | D247: =RC[-1]-58433 -> 7600
A248: 0.11 | B248: 0.04 | C248: 66067 | D248: =RC[-1]-58433 -> 7634
A249: 0.11 | B249: 0.04 | C249: 66100 | D249: =RC[-1]-58433 -> 7667
A250: 0.11 | B250: 0.04 | C250: 66133 | D250: =RC[-1]-58433 -> 7700
A251: 0.11 | B251: 0.03 | C251: 66167 | D251: =RC[-1]-58433 -> 7734
A252: 0.11 | B252: 0.03 | C252: 66200 | D252: =RC[-1]-58433 -> 7767
A253: 0.11 | B253: 0.03 | C253: 66233 | D253: =RC[-1]-58433 -> 7800
A254: 0.11 | B254: 0.03 | C254: 66267 | D254: =RC[-1]-58433 -> 7834
A255: 0.13 | B255: 0.03 | C255: 66300 | D255: =RC[-1]-58433 -> 7867
A256: 0.13 | B256: 0.03 | C256: 66333 | D256: =RC[-1]-58433 -> 7900
A257: 0.13 | B257: 0.03 | C257: 66367 | D257: =RC[-1]-58433 -> 7934
A258: 0.13 | B258: 0.03 | C258: 66400 | D258: =RC[-1]-58433 -> 7967
A259: 0.13 | B259: 0.03 | C259: 66433 | D259: =RC[-1]-58433 -> 8000
A260: 0.13 | B260: 0.03 | C260: 66467 | D260: =RC[-1]-58433 -> 8034
A261: 0.13 | B261: 0.03 | C261: 66500 | D261: =RC[-1]-58433 -> 8067
A262: 0.14000000000000001 | B262: 0.03 | C262: 66533 | D262: =RC[-1]-58433 -> 8100
A263: 0.14000000000000001 | B263: 0.03 | C263: 66567 | D263: =RC[-1]-58433 -> 8134
A264: 0.14000000000000001 | B264: 0.03 | C264: 66600 | D264: =RC[-1]-58433 -> 8167
A265: 0.14000000000000001 | B265: 0.03 | C265: 66633 | D265: =RC[-1]-58433 -> 8200
A266: 0.14000000000000001 | B266: 0.03 | C266: 66667 | D266: =RC[-1]-58433 -> 8234
A267: 0.14000000000000001 | B267: 0.03 | C267: 66700 | D267: =RC[-1]-58433 -> 8267
A268: 0.14000000000000001 | B268: 0.04 | C268: 66733 | D268: =RC[-1]-58433 -> 8300
A269: 0.14000000000000001 | B269: 0.04 | C269: 66767 | D269: =RC[-1]-58433 -> 8334
A270: 0.15 | B270: 0.04 | C270: 66800 | D270: =RC[-1]-58433 -> 8367
A271: 0.15 | B271: 0.04 | C271: 66833 | D271: =RC[-1]-58433 -> 8400
A272: 0.15 | B272: 0.04 | C272: 66867 | D272: =RC[-1]-58433 -> 8434
A273: 0.15 | B273: 0.04 | C273: 66900 | D273: =RC[-1]-58433 -> 8467
A274: 0.15 | B274: 0.04 | C274: 66933 | D274: =RC[-1]-58433 -> 8500
A275: 0.15 | B275: 0.05 | C275: 66967 | D275: =RC[-1]-58433 -> 8534
A276: 0.17 | B276: 0.04 | C276: 67000 | D276: =RC[-1]-58433 -> 8567
A277: 0.17 | B277: 0.05 | C277: 67033 | D277: =RC[-1]-58433 -> 8600
A278: 0.17 | B278: 0.05 | C278: 67067 | D278: =RC[-1]-58433 -> 8634
A279: 0.17 | B279: 0.05 | C279: 67100 | D279: =RC[-1]-58433 -> 8667
A280: 0.17 | B280: 0.05 | C280: 67133 | D280: =RC[-1]-58433 -> 8700
A281: 0.18 | B281: 0.05 | C281: 67167 | D281: =RC[-1]-58433 -> 8734
A282: 0.18 | B282: 0.05 | C282: 67200 | D282: =RC[-1]-58433 -> 8767
A283: 0.18 | B283: 0.05 | C283: 67233 | D283: =RC[-1]-58433 -> 8800
A284: 0.19 | B284: 0.05 | C284: 67267 | D284: =RC[-1]-58433 -> 8834
A285: 0.19 | B285: 0.05 | C285: 67300 | D285: =RC[-1]-58433 -> 8867
A286: 0.19 | B286: 0.05 | C286: 67333 | D286: =RC[-1]-58433 -> 8900
A287: 0.19 | B287: 0.05 | C287: 67367 | D287: =RC[-1]-58433 -> 8934
A288: 0.19 | B288: 0.05 | C288: 67400 | D288: =RC[-1]-58433 -> 8967
A289: 0.19 | B289: 0.06 | C289: 67433 | D289: =RC[-1]-58433 -> 9000
A290: 0.21 | B290: 0.05 | C290: 67467 | D290: =RC[-1]-58433 -> 9034
A291: 0.21 | B291: 0.06 | C291: 67500 | D291: =RC[-1]-58433 -> 9067
A292: 0.21 | B292: 0.06 | C292: 67533 | D292: =RC[-1]-58433 -> 9100
A293: 0.22 | B293: 0.06 | C293: 67567 | D293: =RC[-1]-58433 -> 9134
A294: 0.22 | B294: 0.06 | C294: 67600 | D294: =RC[-1]-58433 -> 9167
A295: 0.22 | B295: 0.06 | C295: 67633 | D295: =RC[-1]-58433 -> 9200
A296: 0.22 | B296: 0.06 | C296: 67667 | D296: =RC[-1]-58433 -> 9234
A297: 0.23 | B297: 0.06 | C297: 67700 | D297: =RC[-1]-58433 -> 9267
A298: 0.23 | B298: 0.06 | C298: 67733 | D298: =RC[-1]-58433 -> 9300
A299: 0.25 | B299: 0.06 | C299: 67767 | D299: =RC[-1]-58433 -> 9334
A300: 0.25 | B300: 0.06 | C300: 67800 | D300: =RC[-1]-58433 -> 9367
A301: 0.25 | B301: 0.06 | C301: 67833 | D301: =RC[-1]-58433 -> 9400
A302: 0.26 | B302: 0.06 | C302: 67867 | D302: =RC[-1]-58433 -> 9434
A303: 0.26 | B303: 0.08 | C303: 67900 | D303: =RC[-1]-58433 -> 9467
A304: 0.26 | B304: 0.08 | C304: 67933 | D304: =RC[-1]-58433 -> 9500
A305: 0.27 | B305: 0.08 | C305: 67967 | D305: =RC[-1]-58433 -> 9534
A306: 0.27 | B306: 0.08 | C306: 68000 | D306: =RC[-1]-58433 -> 9567
A307: 0.27 | B307: 0.08 | C307: 68033 | D307: =RC[-1]-58433 -> 9600
A308: 0.28999999999999998 | B308: 0.08 | C308: 68067 | D308: =RC[-1]-58433 -> 9634
A309: 0.28999999999999998 | B309: 0.08 | C309: 68100 | D309: =RC[-1]-58433 -> 9667
A310: 0.28999999999999998 | B310: 0.09 | C310: 68133 | D310: =RC[-1]-58433 -> 9700
A311: 0.3 | B311: 0.08 | C311: 68167 | D311: =RC[-1]-58433 -> 9734
A312: 0.3 | B312: 0.09 | C312: 68200 | D312: =RC[-1]-58433 -> 9767
A313: 0.31 | B313: 0.09 | C313: 68233 | D313: =RC[-1]-58433 -> 9800
A314: 0.31 | B314: 0.09 | C314: 68267 | D314: =RC[-1]-58433 -> 9834
A315: 0.33 | B315: 0.09 | C315: 68300 | D315: =RC[-1]-58433 -> 9867
A316: 0.33 | B316: 0.09 | C316: 68333 | D316: =RC[-1]-58433 -> 9900
A317: 0.34 | B317: 0.09 | C317: 68367 | D317: =RC[-1]-58433 -> 9934
A318: 0.34 | B318: 0.1 | C318: 68400 | D318: =RC[-1]-58433 -> 9967
A319: 0.35 | B319: 0.09 | C319: 68433 | D319: =RC[-1]-58433 -> 10000
A320: 0.35 | B320: 0.1 | C320: 68467 | D320: =RC[-1]-58433 -> 10034
A321: 0.35 | B321: 0.1 | C321: 68500 | D321: =RC[-1]-58433 -> 10067
A322: 0.37 | B322: 0.1 | C322: 68533 | D322: =RC[-1]-58433 -> 10100
A323: 0.38 | B323: 0.1 | C323: 68567 | D323: =RC[-1]-58433 -> 10134
A324: 0.38 | B324: 0.1 | C324: 68600 | D324: =RC[-1]-58433 -> 10167
A325: 0.38 | B325: 0.12 | C325: 68633 | D325: =RC[-1]-58433 -> 10200
A326: 0.39 | B326: 0.12 | C326: 68667 | D326: =RC[-1]-58433 -> 10234
A327: 0.39 | B327: 0.12 | C327: 68700 | D327: =RC[-1]-58433 -> 10267
A328: 0.41 | B328: 0.12 | C328: 68733 | D328: =RC[-1]-58433 -> 10300
A329: 0.41 | B329: 0.12 | C329: 68767 | D329: =RC[-1]-58433 -> 10334
A330: 0.42 | B330: 0.12 | C330: 68800 | D330: =RC[-1]-58433 -> 10367
A331: 0.42 | B331: 0.12 | C331: 68833 | D331: =RC[-1]-58433 -> 10400
A332: 0.42 | B332: 0.12 | C332: 68867 | D332: =RC[-1]-58433 -> 10434
A333: 0.43 | B333: 0.12 | C333: 68900 | D333: =RC[-1]-58433 -> 10467
A334: 0.43 | B334: 0.13 | C334: 68933 | D334: =RC[-1]-58433 -> 10500
A335: 0.43 | B335: 0.13 | C335: 68967 | D335: =RC[-1]-58433 -> 10534
A336: 0.45 | B336: 0.13 | C336: 69000 | D336: =RC[-1]-58433 -> 10567
A337: 0.46 | B337: 0.13 | C337: 69033 | D337: =RC[-1]-58433 -> 10600
A338: 0.46 | B338: 0.13 | C338: 69067 | D338: =RC[-1]-58433 -> 10634
A339: 0.46 | B339: 0.14000000000000001 | C339: 69100 | D339: =RC[-1]-58433 -> 10667
A340: 0.47 | B340: 0.14000000000000001 | C340: 69133 | D340: =RC[-1]-58433 -> 10700
A341: 0.47 | B341: 0.14000000000000001 | C341: 69167 | D341: =RC[-1]-58433 -> 10734
A342: 0.49 | B342: 0.14000000000000001 | C342: 69200 | D342: =RC[-1]-58433 -> 10767
A343: 0.49 | B343: 0.14000000000000001 | C343: 69233 | D343: =RC[-1]-58433 -> 10800
A344: 0.49 | B344: 0.14000000000000001 | C344: 69267 | D344: =RC[-1]-58433 -> 10834
A345: 0.5 | B345: 0.14000000000000001 | C345: 69300 | D345: =RC[-1]-58433 -> 10867
A346: 0.5 | B346: 0.16 | C346: 69333 | D346: =RC[-1]-58433 -> 10900
A347: 0.51 | B347: 0.16 | C347: 69367 | D347: =RC[-1]-58433 -> 10934
A348: 0.51 | B348: 0.16 | C348: 69400 | D348: =RC[-1]-58433 -> 10967
A349: 0.53 | B349: 0.16 | C349: 69433 | D349: =RC[-1]-58433 -> 11000
A350: 0.53 | B350: 0.16 | C350: 69467 | D350: =RC[-1]-58433 -> 11034
A351: 0.54 | B351: 0.17 | C351: 69500 | D351: =RC[-1]-58433 -> 11067
A352: 0.54 | B352: 0.17 | C352: 69533 | D352: =RC[-1]-58433 -> 11100
A353: 0.55000000000000004 | B353: 0.17 | C353: 69567 | D353: =RC[-1]-58433 -> 11134
A354: 0.56999999999999995 | B354: 0.17 | C354: 69600 | D354: =RC[-1]-58433 -> 11167
A355: 0.56999999999999995 | B355: 0.17 | C355: 69633 | D355: =RC[-1]-58433 -> 11200
A356: 0.57999999999999996 | B356: 0.18 | C356: 69667 | D356: =RC[-1]-58433 -> 11234
A357: 0.59 | B357: 0.18 | C357: 69700 | D357: =RC[-1]-58433 -> 11267
A358: 0.59 | B358: 0.18 | C358: 69733 | D358: =RC[-1]-58433 -> 11300
A359: 0.59 | B359: 0.2 | C359: 69767 | D359: =RC[-1]-58433 -> 11334
A360: 0.61 | B360: 0.2 | C360: 69800 | D360: =RC[-1]-58433 -> 11367
A361: 0.62 | B361: 0.2 | C361: 69833 | D361: =RC[-1]-58433 -> 11400
A362: 0.62 | B362: 0.2 | C362: 69867 | D362: =RC[-1]-58433 -> 11434
A363: 0.63 | B363: 0.2 | C363: 69900 | D363: =RC[-1]-58433 -> 11467
A364: 0.65 | B364: 0.2 | C364: 69933 | D364: =RC[-1]-58433 -> 11500
A365: 0.65 | B365: 0.21 | C365: 69967 | D365: =RC[-1]-58433 -> 11534
A366: 0.66 | B366: 0.21 | C366: 70000 | D366: =RC[-1]-58433 -> 11567
A367: 0.67 | B367: 0.22 | C367: 70033 | D367: =RC[-1]-58433 -> 11600
A368: 0.67 | B368: 0.22 | C368: 70067 | D368: =RC[-1]-58433 -> 11634
A369: 0.69 | B369: 0.22 | C369: 70100 | D369: =RC[-1]-58433 -> 11667
A370: 0.7 | B370: 0.22 | C370: 70133 | D370: =RC[-1]-58433 -> 11700
A371: 0.7 | B371: 0.24 | C371: 70167 | D371: =RC[-1]-58433 -> 11734
A372: 0.71 | B372: 0.24 | C372: 70200 | D372: =RC[-1]-58433 -> 11767
A373: 0.73 | B373: 0.25 | C373: 70233 | D373: =RC[-1]-58433 -> 11800
A374: 0.74 | B374: 0.25 | C374: 70267 | D374: =RC[-1]-58433 -> 11834
A375: 0.75 | B375: 0.25 | C375: 70300 | D375: =RC[-1]-58433 -> 11867
A376: 0.75 | B376: 0.26 | C376: 70333 | D376: =RC[-1]-58433 -> 11900
A377: 0.78 | B377: 0.26 | C377: 70367 | D377: =RC[-1]-58433 -> 11934
A378: 0.78 | B378: 0.26 | C378: 70400 | D378: =RC[-1]-58433 -> 11967
A379: 0.79 | B379: 0.28000000000000003 | C379: 70433 | D379: =RC[-1]-58433 -> 12000
A380: 0.81 | B380: 0.28000000000000003 | C380: 70467 | D380: =RC[-1]-58433 -> 12034
A381: 0.81 | B381: 0.28000000000000003 | C381: 70500 | D381: =RC[-1]-58433 -> 12067
A382: 0.82 | B382: 0.28000000000000003 | C382: 70533 | D382: =RC[-1]-58433 -> 12100
A383: 0.83 | B383: 0.28999999999999998 | C383: 70567 | D383: =RC[-1]-58433 -> 12134
A384: 0.85 | B384: 0.28999999999999998 | C384: 70600 | D384: =RC[-1]-58433 -> 12167
A385: 0.85 | B385: 0.28999999999999998 | C385: 70633 | D385: =RC[-1]-58433 -> 12200
A386: 0.86 | B386: 0.3 | C386: 70667 | D386: =RC[-1]-58433 -> 12234
A387: 0.86 | B387: 0.3 | C387: 70700 | D387: =RC[-1]-58433 -> 12267
A388: 0.87 | B388: 0.3 | C388: 70733 | D388: =RC[-1]-58433 -> 12300
A389: 0.89 | B389: 0.3 | C389: 70767 | D389: =RC[-1]-58433 -> 12334
A390: 0.89 | B390: 0.32 | C390: 70800 | D390: =RC[-1]-58433 -> 12367
A391: 0.89 | B391: 0.32 | C391: 70833 | D391: =RC[-1]-58433 -> 12400
A392: 0.9 | B392: 0.32 | C392: 70867 | D392: =RC[-1]-58433 -> 12434
A393: 0.91 | B393: 0.33 | C393: 70900 | D393: =RC[-1]-58433 -> 12467
A394: 0.91 | B394: 0.33 | C394: 70933 | D394: =RC[-1]-58433 -> 12500
A395: 0.91 | B395: 0.33 | C395: 70967 | D395: =RC[-1]-58433 -> 12534
A396: 0.93 | B396: 0.33 | C396: 71000 | D396: =RC[-1]-58433 -> 12567
A397: 0.94 | B397: 0.33 | C397: 71033 | D397: =RC[-1]-58433 -> 12600
A398: 0.94 | B398: 0.33 | C398: 71067 | D398: =RC[-1]-58433 -> 12634
A399: 0.94 | B399: 0.34 | C399: 71100 | D399: =RC[-1]-58433 -> 12667
A400: 0.94 | B400: 0.34 | C400: 71133 | D400: =RC[-1]-58433 -> 12700
A401: 0.95 | B401: 0.34 | C401: 71167 | D401: =RC[-1]-58433 -> 12734
A402: 0.97 | B402: 0.34 | C402: 71200 | D402: =RC[-1]-58433 -> 12767
A403: 0.97 | B403: 0.36 | C403: 71233 | D403: =RC[-1]-58433 -> 12800
A404: 0.97 | B404: 0.36 | C404: 71267 | D404: =RC[-1]-58433 -> 12834
A405: 0.98 | B405: 0.36 | C405: 71300 | D405: =RC[-1]-58433 -> 12867
A406: 0.98 | B406: 0.36 | C406: 71333 | D406: =RC[-1]-58433 -> 12900
A407: 0.99 | B407: 0.36 | C407: 71367 | D407: =RC[-1]-58433 -> 12934
A408: 0.99 | B408: 0.36 | C408: 71400 | D408: =RC[-1]-58433 -> 12967
A409: 0.99 | B409: 0.37 | C409: 71433 | D409: =RC[-1]-58433 -> 13000
A410: 0.99 | B410: 0.37 | C410: 71467 | D410: =RC[-1]-58433 -> 13034
A411: 1.01 | B411: 0.37 | C411: 71500 | D411: =RC[-1]-58433 -> 13067
A412: 1.01 | B412: 0.37 | C412: 71533 | D412: =RC[-1]-58433 -> 13100
A413: 1.02 | B413: 0.38 | C413: 71567 | D413: =RC[-1]-58433 -> 13134
A414: 1.02 | B414: 0.38 | C414: 71600 | D414: =RC[-1]-58433 -> 13167
A415: 1.02 | B415: 0.38 | C415: 71633 | D415: =RC[-1]-58433 -> 13200
A416: 1.03 | B416: 0.38 | C416: 71667 | D416: =RC[-1]-58433 -> 13234
A417: 1.05 | B417: 0.38 | C417: 71700 | D417: =RC[-1]-58433 -> 13267
A418: 1.05 | B418: 0.4 | C418: 71733 | D418: =RC[-1]-58433 -> 13300
A419: 1.05 | B419: 0.4 | C419: 71767 | D419: =RC[-1]-58433 -> 13334
A420: 1.05 | B420: 0.4 | C420: 71800 | D420: =RC[-1]-58433 -> 13367
A421: 1.06 | B421: 0.4 | C421: 71833 | D421: =RC[-1]-58433 -> 13400
A422: 1.07 | B422: 0.41 | C422: 71867 | D422: =RC[-1]-58433 -> 13434
A423: 1.07 | B423: 0.41 | C423: 71900 | D423: =RC[-1]-58433 -> 13467
A424: 1.07 | B424: 0.41 | C424: 71933 | D424: =RC[-1]-58433 -> 13500
A425: 1.0900000000000001 | B425: 0.41 | C425: 71967 | D425: =RC[-1]-58433 -> 13534
A426: 1.1000000000000001 | B426: 0.42 | C426: 72000 | D426: =RC[-1]-58433 -> 13567
A427: 1.1000000000000001 | B427: 0.42 | C427: 72033 | D427: =RC[-1]-58433 -> 13600
A428: 1.1000000000000001 | B428: 0.42 | C428: 72067 | D428: =RC[-1]-58433 -> 13634
A429: 1.1100000000000001 | B429: 0.44 | C429: 72100 | D429: =RC[-1]-58433 -> 13667
A430: 1.1299999999999999 | B430: 0.44 | C430: 72133 | D430: =RC[-1]-58433 -> 13700
A431: 1.1299999999999999 | B431: 0.44 | C431: 72167 | D431: =RC[-1]-58433 -> 13734
A432: 1.1399999999999999 | B432: 0.44 | C432: 72200 | D432: =RC[-1]-58433 -> 13767
A433: 1.1499999999999999 | B433: 0.45 | C433: 72233 | D433: =RC[-1]-58433 -> 13800
A434: 1.1499999999999999 | B434: 0.45 | C434: 72267 | D434: =RC[-1]-58433 -> 13834
A435: 1.1499999999999999 | B435: 0.45 | C435: 72300 | D435: =RC[-1]-58433 -> 13867
A436: 1.17 | B436: 0.46 | C436: 72333 | D436: =RC[-1]-58433 -> 13900
A437: 1.18 | B437: 0.46 | C437: 72367 | D437: =RC[-1]-58433 -> 13934
A438: 1.18 | B438: 0.48 | C438: 72400 | D438: =RC[-1]-58433 -> 13967
A439: 1.19 | B439: 0.48 | C439: 72433 | D439: =RC[-1]-58433 -> 14000
A440: 1.19 | B440: 0.48 | C440: 72467 | D440: =RC[-1]-58433 -> 14034
A441: 1.19 | B441: 0.49 | C441: 72500 | D441: =RC[-1]-58433 -> 14067
A442: 1.21 | B442: 0.49 | C442: 72533 | D442: =RC[-1]-58433 -> 14100
A443: 1.22 | B443: 0.49 | C443: 72567 | D443: =RC[-1]-58433 -> 14134
A444: 1.22 | B444: 0.5 | C444: 72600 | D444: =RC[-1]-58433 -> 14167
A445: 1.23 | B445: 0.5 | C445: 72633 | D445: =RC[-1]-58433 -> 14200
A446: 1.25 | B446: 0.5 | C446: 72667 | D446: =RC[-1]-58433 -> 14234
A447: 1.25 | B447: 0.52 | C447: 72700 | D447: =RC[-1]-58433 -> 14267
A448: 1.26 | B448: 0.52 | C448: 72733 | D448: =RC[-1]-58433 -> 14300
A449: 1.28 | B449: 0.53 | C449: 72767 | D449: =RC[-1]-58433 -> 14334
A450: 1.29 | B450: 0.53 | C450: 72800 | D450: =RC[-1]-58433 -> 14367
A451: 1.3 | B451: 0.54 | C451: 72833 | D451: =RC[-1]-58433 -> 14400
A452: 1.31 | B452: 0.54 | C452: 72867 | D452: =RC[-1]-58433 -> 14434
A453: 1.31 | B453: 0.56000000000000005 | C453: 72900 | D453: =RC[-1]-58433 -> 14467
A454: 1.33 | B454: 0.56000000000000005 | C454: 72933 | D454: =RC[-1]-58433 -> 14500
A455: 1.34 | B455: 0.56999999999999995 | C455: 72967 | D455: =RC[-1]-58433 -> 14534
A456: 1.35 | B456: 0.56999999999999995 | C456: 73000 | D456: =RC[-1]-58433 -> 14567
A457: 1.36 | B457: 0.57999999999999996 | C457: 73033 | D457: =RC[-1]-58433 -> 14600
A458: 1.37 | B458: 0.57999999999999996 | C458: 73067 | D458: =RC[-1]-58433 -> 14634
A459: 1.38 | B459: 0.6 | C459: 73100 | D459: =RC[-1]-58433 -> 14667
A460: 1.4 | B460: 0.6 | C460: 73133 | D460: =RC[-1]-58433 -> 14700
A461: 1.41 | B461: 0.61 | C461: 73167 | D461: =RC[-1]-58433 -> 14734
A462: 1.41 | B462: 0.61 | C462: 73200 | D462: =RC[-1]-58433 -> 14767
A463: 1.42 | B463: 0.62 | C463: 73233 | D463: =RC[-1]-58433 -> 14800
A464: 1.44 | B464: 0.62 | C464: 73267 | D464: =RC[-1]-58433 -> 14834
A465: 1.44 | B465: 0.64 | C465: 73300 | D465: =RC[-1]-58433 -> 14867
A466: 1.45 | B466: 0.64 | C466: 73333 | D466: =RC[-1]-58433 -> 14900
A467: 1.46 | B467: 0.65 | C467: 73367 | D467: =RC[-1]-58433 -> 14934
A468: 1.48 | B468: 0.65 | C468: 73400 | D468: =RC[-1]-58433 -> 14967
A469: 1.48 | B469: 0.66 | C469: 73433 | D469: =RC[-1]-58433 -> 15000
A470: 1.49 | B470: 0.66 | C470: 73467 | D470: =RC[-1]-58433 -> 15034
A471: 1.49 | B471: 0.68 | C471: 73500 | D471: =RC[-1]-58433 -> 15067
A472: 1.5 | B472: 0.68 | C472: 73533 | D472: =RC[-1]-58433 -> 15100
A473: 1.52 | B473: 0.68 | C473: 73567 | D473: =RC[-1]-58433 -> 15134
A474: 1.53 | B474: 0.69 | C474: 73600 | D474: =RC[-1]-58433 -> 15167
A475: 1.54 | B475: 0.69 | C475: 73633 | D475: =RC[-1]-58433 -> 15200
A476: 1.54 | B476: 0.7 | C476: 73667 | D476: =RC[-1]-58433 -> 15234
A477: 1.56 | B477: 0.7 | C477: 73700 | D477: =RC[-1]-58433 -> 15267
A478: 1.56 | B478: 0.72 | C478: 73733 | D478: =RC[-1]-58433 -> 15300
A479: 1.57 | B479: 0.72 | C479: 73767 | D479: =RC[-1]-58433 -> 15334
A480: 1.57 | B480: 0.73 | C480: 73800 | D480: =RC[-1]-58433 -> 15367
A481: 1.58 | B481: 0.73 | C481: 73833 | D481: =RC[-1]-58433 -> 15400
A482: 1.6 | B482: 0.73 | C482: 73867 | D482: =RC[-1]-58433 -> 15434
A483: 1.6 | B483: 0.74 | C483: 73900 | D483: =RC[-1]-58433 -> 15467
A484: 1.61 | B484: 0.74 | C484: 73933 | D484: =RC[-1]-58433 -> 15500
A485: 1.61 | B485: 0.76 | C485: 73967 | D485: =RC[-1]-58433 -> 15534
A486: 1.62 | B486: 0.76 | C486: 74000 | D486: =RC[-1]-58433 -> 15567
A487: 1.62 | B487: 0.76 | C487: 74033 | D487: =RC[-1]-58433 -> 15600
A488: 1.64 | B488: 0.77 | C488: 74067 | D488: =RC[-1]-58433 -> 15634
A489: 1.65 | B489: 0.77 | C489: 74100 | D489: =RC[-1]-58433 -> 15667
A490: 1.65 | B490: 0.78 | C490: 74133 | D490: =RC[-1]-58433 -> 15700
A491: 1.66 | B491: 0.78 | C491: 74167 | D491: =RC[-1]-58433 -> 15734
A492: 1.66 | B492: 0.8 | C492: 74200 | D492: =RC[-1]-58433 -> 15767
A493: 1.68 | B493: 0.81 | C493: 74233 | D493: =RC[-1]-58433 -> 15800
A494: 1.69 | B494: 0.81 | C494: 74267 | D494: =RC[-1]-58433 -> 15834
A495: 1.7 | B495: 0.82 | C495: 74300 | D495: =RC[-1]-58433 -> 15867
A496: 1.7 | B496: 0.84 | C496: 74333 | D496: =RC[-1]-58433 -> 15900
A497: 1.72 | B497: 0.84 | C497: 74367 | D497: =RC[-1]-58433 -> 15934
A498: 1.73 | B498: 0.85 | C498: 74400 | D498: =RC[-1]-58433 -> 15967
A499: 1.74 | B499: 0.86 | C499: 74433 | D499: =RC[-1]-58433 -> 16000
A500: 1.76 | B500: 0.86 | C500: 74467 | D500: =RC[-1]-58433 -> 16034
A501: 1.77 | B501: 0.88 | C501: 74500 | D501: =RC[-1]-58433 -> 16067
A502: 1.78 | B502: 0.88 | C502: 74533 | D502: =RC[-1]-58433 -> 16100
A503: 1.78 | B503: 0.89 | C503: 74567 | D503: =RC[-1]-58433 -> 16134
A504: 1.81 | B504: 0.9 | C504: 74600 | D504: =RC[-1]-58433 -> 16167
A505: 1.81 | B505: 0.9 | C505: 74633 | D505: =RC[-1]-58433 -> 16200
A506: 1.82 | B506: 0.92 | C506: 74667 | D506: =RC[-1]-58433 -> 16234
A507: 1.84 | B507: 0.92 | C507: 74700 | D507: =RC[-1]-58433 -> 16267
A508: 1.84 | B508: 0.93 | C508: 74733 | D508: =RC[-1]-58433 -> 16300
A509: 1.85 | B509: 0.94 | C509: 74767 | D509: =RC[-1]-58433 -> 16334
A510: 1.86 | B510: 0.94 | C510: 74800 | D510: =RC[-1]-58433 -> 16367
A511: 1.86 | B511: 0.94 | C511: 74833 | D511: =RC[-1]-58433 -> 16400
A512: 1.88 | B512: 0.96 | C512: 74867 | D512: =RC[-1]-58433 -> 16434
A513: 1.88 | B513: 0.97 | C513: 74900 | D513: =RC[-1]-58433 -> 16467
A514: 1.89 | B514: 0.97 | C514: 74933 | D514: =RC[-1]-58433 -> 16500
A515: 1.89 | B515: 0.98 | C515: 74967 | D515: =RC[-1]-58433 -> 16534
A516: 1.9 | B516: 1 | C516: 75000 | D516: =RC[-1]-58433 -> 16567
A517: 1.92 | B517: 1.01 | C517: 75033 | D517: =RC[-1]-58433 -> 16600
A518: 1.93 | B518: 1.02 | C518: 75067 | D518: =RC[-1]-58433 -> 16634
A519: 1.94 | B519: 1.02 | C519: 75100 | D519: =RC[-1]-58433 -> 16667
A520: 1.94 | B520: 1.04 | C520: 75133 | D520: =RC[-1]-58433 -> 16700
A521: 1.97 | B521: 1.05 | C521: 75167 | D521: =RC[-1]-58433 -> 16734
A522: 1.97 | B522: 1.06 | C522: 75200 | D522: =RC[-1]-58433 -> 16767
A523: 1.98 | B523: 1.06 | C523: 75233 | D523: =RC[-1]-58433 -> 16800
A524: 2 | B524: 1.08 | C524: 75267 | D524: =RC[-1]-58433 -> 16834
A525: 2 | B525: 1.08 | C525: 75300 | D525: =RC[-1]-58433 -> 16867
A526: 2.0099999999999998 | B526: 1.0900000000000001 | C526: 75333 | D526: =RC[-1]-58433 -> 16900
A527: 2.02 | B527: 1.1000000000000001 | C527: 75367 | D527: =RC[-1]-58433 -> 16934
A528: 2.04 | B528: 1.1200000000000001 | C528: 75400 | D528: =RC[-1]-58433 -> 16967
A529: 2.0499999999999998 | B529: 1.1299999999999999 | C529: 75433 | D529: =RC[-1]-58433 -> 17000
A530: 2.06 | B530: 1.1399999999999999 | C530: 75467 | D530: =RC[-1]-58433 -> 17034
A531: 2.08 | B531: 1.1599999999999999 | C531: 75500 | D531: =RC[-1]-58433 -> 17067
A532: 2.09 | B532: 1.17 | C532: 75533 | D532: =RC[-1]-58433 -> 17100
A533: 2.1 | B533: 1.18 | C533: 75567 | D533: =RC[-1]-58433 -> 17134
A534: 2.1 | B534: 1.18 | C534: 75600 | D534: =RC[-1]-58433 -> 17167
A535: 2.12 | B535: 1.2 | C535: 75633 | D535: =RC[-1]-58433 -> 17200
A536: 2.13 | B536: 1.2 | C536: 75667 | D536: =RC[-1]-58433 -> 17234
A537: 2.13 | B537: 1.21 | C537: 75700 | D537: =RC[-1]-58433 -> 17267
A538: 2.14 | B538: 1.22 | C538: 75733 | D538: =RC[-1]-58433 -> 17300
A539: 2.16 | B539: 1.22 | C539: 75767 | D539: =RC[-1]-58433 -> 17334
A540: 2.16 | B540: 1.24 | C540: 75800 | D540: =RC[-1]-58433 -> 17367
A541: 2.17 | B541: 1.25 | C541: 75833 | D541: =RC[-1]-58433 -> 17400
A542: 2.1800000000000002 | B542: 1.25 | C542: 75867 | D542: =RC[-1]-58433 -> 17434
A543: 2.1800000000000002 | B543: 1.26 | C543: 75900 | D543: =RC[-1]-58433 -> 17467
A544: 2.2000000000000002 | B544: 1.28 | C544: 75933 | D544: =RC[-1]-58433 -> 17500
A546: Track
A547: Label : | B547: pos_blue
A548: Coords (x,y:cm; t:time)
A549: x | B549: y | C549: t
A550: -0.18 | B550: 0.43 | C550: 58433
A551: -0.18 | B551: 0.43 | C551: 58467
A552: -0.18 | B552: 0.43 | C552: 58500
A553: -0.18 | B553: 0.43 | C553: 58533
A554: -0.18 | B554: 0.41 | C554: 58567
A555: -0.18 | B555: 0.41 | C555: 58600
A556: -0.18 | B556: 0.41 | C556: 58633
A557: -0.18 | B557: 0.41 | C557: 58667
A558: -0.18 | B558: 0.41 | C558: 58700
A559: -0.18 | B559: 0.41 | C559: 58733
A560: -0.18 | B560: 0.41 | C560: 58767
A561: -0.18 | B561: 0.41 | C561: 58800
A562: -0.18 | B562: 0.41 | C562: 58833
A563: -0.18 | B563: 0.41 | C563: 58867
A564: -0.18 | B564: 0.41 | C564: 58900
A565: -0.18 | B565: 0.41 | C565: 58933
A566: -0.19 | B566: 0.41 | C566: 58967
A567: -0.19 | B567: 0.41 | C567: 59000
A568: -0.19 | B568: 0.41 | C568: 59033
A569: -0.19 | B569: 0.41 | C569: 59067
A570: -0.19 | B570: 0.41 | C570: 59100
A571: -0.19 | B571: 0.41 | C571: 59133
A572: -0.19 | B572: 0.41 | C572: 59167
A573: -0.19 | B573: 0.41 | C573: 59200
A574: -0.19 | B574: 0.41 | C574: 59233
A575: -0.19 | B575: 0.42 | C575: 59267
A576: -0.19 | B576: 0.42 | C576: 59300
A577: -0.19 | B577: 0.42 | C577: 59333
A578: -0.19 | B578: 0.42 | C578: 59367
A579: -0.19 | B579: 0.42 | C579: 59400
A580: -0.19 | B580: 0.42 | C580: 59433
A581: -0.19 | B581: 0.42 | C581: 59467
A582: -0.19 | B582: 0.42 | C582: 59500
A583: -0.19 | B583: 0.42 | C583: 59533
A584: -0.19 | B584: 0.42 | C584: 59567
A585: -0.19 | B585: 0.42 | C585: 59600
A586: -0.19 | B586: 0.43 | C586: 59633
A587: -0.19 | B587: 0.43 | C587: 59667
A588: -0.19 | B588: 0.43 | C588: 59700
A589: -0.19 | B589: 0.43 | C589: 59733
A590: -0.19 | B590: 0.43 | C590: 59767
A591: -0.19 | B591: 0.43 | C591: 59800
A592: -0.19 | B592: 0.43 | C592: 59833
A593: -0.19 | B593: 0.43 | C593: 59867
A594: -0.19 | B594: 0.43 | C594: 59900
A595: -0.19 | B595: 0.43 | C595: 59933
A596: -0.19 | B596: 0.43 | C596: 59967
A597: -0.19 | B597: 0.43 | C597: 60000
A598: -0.19 | B598: 0.43 | C598: 60033
A599: -0.19 | B599: 0.43 | C599: 60067
A600: -0.19 | B600: 0.43 | C600: 60100
A601: -0.19 | B601: 0.43 | C601: 60133
A602: -0.19 | B602: 0.43 | C602: 60167
A603: -0.17 | B603: 0.42 | C603: 60200
A604: -0.19 | B604: 0.43 | C604: 60233
A605: -0.19 | B605: 0.43 | C605: 60267
A606: -0.19 | B606: 0.43 | C606: 60300
A607: -0.17 | B607: 0.42 | C607: 60333
A608: -0.17 | B608: 0.42 | C608: 60367
A609: -0.17 | B609: 0.42 | C609: 60400
A610: -0.17 | B610: 0.42 | C610: 60433
A611: -0.17 | B611: 0.42 | C611: 60467
A612: -0.17 | B612: 0.42 | C612: 60500
A613: -0.17 | B613: 0.42 | C613: 60533
A614: -0.17 | B614: 0.42 | C614: 60567
A615: -0.17 | B615: 0.42 | C615: 60600
A616: -0.17 | B616: 0.42 | C616: 60633
A617: -0.17 | B617: 0.42 | C617: 60667
A618: -0.17 | B618: 0.42 | C618: 60700
A619: -0.17 | B619: 0.42 | C619: 60733
A620: -0.17 | B620: 0.42 | C620: 60767
A621: -0.17 | B621: 0.42 | C621: 60800
A622: -0.17 | B622: 0.42 | C622: 60833
A623: -0.17 | B623: 0.42 | C623: 60867
A624: -0.17 | B624: 0.42 | C624: 60900
A625: -0.17 | B625: 0.42 | C625: 60933
A626: -0.17 | B626: 0.42 | C626: 60967
A627: -0.17 | B627: 0.42 | C627: 61000
A628: -0.17 | B628: 0.42 | C628: 61033
A629: -0.17 | B629: 0.42 | C629: 61067
A630: -0.17 | B630: 0.42 | C630: 61100
A631: -0.17 | B631: 0.42 | C631: 61133
A632: -0.17 | B632: 0.42 | C632: 61167
A633: -0.17 | B633: 0.42 | C633: 61200
A634: -0.17 | B634: 0.42 | C634: 61233
A635: -0.17 | B635: 0.42 | C635: 61267
A636: -0.17 | B636: 0.42 | C636: 61300
A637: -0.17 | B637: 0.42 | C637: 61333
A638: -0.17 | B638: 0.42 | C638: 61367
A639: -0.17 | B639: 0.43 | C639: 61400
A640: -0.17 | B640: 0.42 | C640: 61433
A641: -0.17 | B641: 0.42 | C641: 61467
A642: -0.17 | B642: 0.42 | C642: 61500
A643: -0.17 | B643: 0.43 | C643: 61533
A644: -0.17 | B644: 0.43 | C644: 61567
A645: -0.17 | B645: 0.43 | C645: 61600
A646: -0.17 | B646: 0.43 | C646: 61633
A647: -0.17 | B647: 0.43 | C647: 61667
A648: -0.17 | B648: 0.43 | C648: 61700
A649: -0.17 | B649: 0.43 | C649: 61733
A650: -0.17 | B650: 0.43 | C650: 61767
A651: -0.17 | B651: 0.43 | C651: 61800
A652: -0.16 | B652: 0.42 | C652: 61833
A653: -0.17 | B653: 0.43 | C653: 61867
A654: -0.16 | B654: 0.42 | C654: 61900
A655: -0.16 | B655: 0.42 | C655: 61933
A656: -0.16 | B656: 0.42 | C656: 61967
A657: -0.16 | B657: 0.42 | C657: 62000
A658: -0.16 | B658: 0.42 | C658: 62033
A659: -0.16 | B659: 0.42 | C659: 62067
A660: -0.16 | B660: 0.42 | C660: 62100
A661: -0.16 | B661: 0.42 | C661: 62133
A662: -0.16 | B662: 0.42 | C662: 62167
A663: -0.16 | B663: 0.42 | C663: 62200
A664: -0.16 | B664: 0.42 | C664: 62233
A665: -0.16 | B665: 0.42 | C665: 62267
A666: -0.16 | B666: 0.42 | C666: 62300
A667: -0.16 | B667: 0.42 | C667: 62333
A668: -0.16 | B668: 0.42 | C668: 62367
A669: -0.16 | B669: 0.42 | C669: 62400
A670: -0.16 | B670: 0.42 | C670: 62433
A671: -0.16 | B671: 0.42 | C671: 62467
A672: -0.16 | B672: 0.42 | C672: 62500
A673: -0.16 | B673: 0.42 | C673: 62533
A674: -0.16 | B674: 0.42 | C674: 62567
A675: -0.16 | B675: 0.42 | C675: 62600
A676: -0.16 | B676: 0.43 | C676: 62633
A677: -0.16 | B677: 0.43 | C677: 62667
A678: -0.16 | B678: 0.43 | C678: 62700
A679: -0.16 | B679: 0.43 | C679: 62733
A680: -0.16 | B680: 0.43 | C680: 62767
A681: -0.16 | B681: 0.43 | C681: 62800
A682: -0.16 | B682: 0.43 | C682: 62833
A683: -0.16 | B683: 0.43 | C683: 62867
A684: -0.16 | B684: 0.43 | C684: 62900
A685: -0.16 | B685: 0.43 | C685: 62933
A686: -0.16 | B686: 0.43 | C686: 62967
A687: -0.16 | B687: 0.43 | C687: 63000
A688: -0.14000000000000001 | B688: 0.42 | C688: 63033
A689: -0.14000000000000001 | B689: 0.42 | C689: 63067
A690: -0.14000000000000001 | B690: 0.42 | C690: 63100
A691: -0.14000000000000001 | B691: 0.42 | C691: 63133
A692: -0.14000000000000001 | B692: 0.42 | C692: 63167
A693: -0.14000000000000001 | B693: 0.42 | C693: 63200
A694: -0.14000000000000001 | B694: 0.42 | C694: 63233
A695: -0.14000000000000001 | B695: 0.42 | C695: 63267
A696: -0.14000000000000001 | B696: 0.42 | C696: 63300
A697: -0.14000000000000001 | B697: 0.42 | C697: 63333
A698: -0.14000000000000001 | B698: 0.42 | C698: 63367
A699: -0.14000000000000001 | B699: 0.42 | C699: 63400
A700: -0.14000000000000001 | B700: 0.42 | C700: 63433
A701: -0.14000000000000001 | B701: 0.42 | C701: 63467
A702: -0.14000000000000001 | B702: 0.42 | C702: 63500
A703: -0.14000000000000001 | B703: 0.42 | C703: 63533
A704: -0.14000000000000001 | B704: 0.42 | C704: 63567
A705: -0.14000000000000001 | B705: 0.42 | C705: 63600
A706: -0.14000000000000001 | B706: 0.42 | C706: 63633
A707: -0.14000000000000001 | B707: 0.43 | C707: 63667
A708: -0.14000000000000001 | B708: 0.43 | C708: 63700
A709: -0.14000000000000001 | B709: 0.43 | C709: 63733
A710: -0.14000000000000001 | B710: 0.43 | C710: 63767
A711: -0.14000000000000001 | B711: 0.43 | C711: 63800
A712: -0.13 | B712: 0.42 | C712: 63833
A713: -0.13 | B713: 0.42 | C713: 63867
A714: -0.13 | B714: 0.42 | C714: 63900
A715: -0.13 | B715: 0.42 | C715: 63933
A716: -0.13 | B716: 0.42 | C716: 63967
A717: -0.13 | B717: 0.42 | C717: 64000
A718: -0.13 | B718: 0.42 | C718: 64033
A719: -0.13 | B719: 0.43 | C719: 64067
A720: -0.13 | B720: 0.43 | C720: 64100
A721: -0.13 | B721: 0.43 | C721: 64133
A722: -0.13 | B722: 0.43 | C722: 64167
A723: -0.13 | B723: 0.43 | C723: 64200
A724: -0.13 | B724: 0.43 | C724: 64233
A725: -0.13 | B725: 0.43 | C725: 64267
A726: -0.12 | B726: 0.42 | C726: 64300
A727: -0.12 | B727: 0.42 | C727: 64333
A728: -0.12 | B728: 0.42 | C728: 64367
A729: -0.12 | B729: 0.42 | C729: 64400
A730: -0.12 | B730: 0.42 | C730: 64433
A731: -0.12 | B731: 0.42 | C731: 64467
A732: -0.12 | B732: 0.43 | C732: 64500
A733: -0.12 | B733: 0.43 | C733: 64533
A734: -0.12 | B734: 0.43 | C734: 64567
A735: -0.12 | B735: 0.43 | C735: 64600
A736: -0.12 | B736: 0.43 | C736: 64633
A737: -0.12 | B737: 0.43 | C737: 64667
A738: -0.12 | B738: 0.43 | C738: 64700
A739: -0.12 | B739: 0.43 | C739: 64733
A740: -0.12 | B740: 0.43 | C740: 64767
A741: -0.11 | B741: 0.43 | C741: 64800
A742: -0.11 | B742: 0.43 | C742: 64833
A743: -0.11 | B743: 0.43 | C743: 64867
A744: -0.11 | B744: 0.43 | C744: 64900
A745: -0.11 | B745: 0.45 | C745: 64933
A746: -0.11 | B746: 0.45 | C746: 64967
A747: -0.11 | B747: 0.45 | C747: 65000
A748: -0.11 | B748: 0.45 | C748: 65033
A749: -0.1 | B749: 0.42 | C749: 65067
A750: -0.1 | B750: 0.42 | C750: 65100
A751: -0.1 | B751: 0.42 | C751: 65133
A752: -0.1 | B752: 0.42 | C752: 65167
A753: -0.11 | B753: 0.42 | C753: 65200
A754: -0.11 | B754: 0.42 | C754: 65233
A755: -0.11 | B755: 0.43 | C755: 65267
A756: -0.11 | B756: 0.43 | C756: 65300
A757: -0.1 | B757: 0.43 | C757: 65333
A758: -0.1 | B758: 0.43 | C758: 65367
A759: -0.1 | B759: 0.43 | C759: 65400
A760: -0.1 | B760: 0.43 | C760: 65433
A761: -0.1 | B761: 0.43 | C761: 65467
A762: -0.1 | B762: 0.43 | C762: 65500
A763: -0.1 | B763: 0.43 | C763: 65533
A764: -0.11 | B764: 0.43 | C764: 65567
A765: -0.11 | B765: 0.43 | C765: 65600
A766: -0.11 | B766: 0.43 | C766: 65633
A767: -0.11 | B767: 0.45 | C767: 65667
A768: -0.11 | B768: 0.45 | C768: 65700
A769: -0.11 | B769: 0.45 | C769: 65733
A770: -0.11 | B770: 0.45 | C770: 65767
A771: -0.11 | B771: 0.45 | C771: 65800
A772: -0.1 | B772: 0.43 | C772: 65833
A773: -0.1 | B773: 0.43 | C773: 65867
A774: -0.1 | B774: 0.43 | C774: 65900
A775: -0.1 | B775: 0.43 | C775: 65933
A776: -0.1 | B776: 0.44 | C776: 65967
A777: -0.1 | B777: 0.44 | C777: 66000
A778: -0.1 | B778: 0.44 | C778: 66033
A779: -0.1 | B779: 0.45 | C779: 66067
A780: -0.1 | B780: 0.45 | C780: 66100
A781: -0.1 | B781: 0.45 | C781: 66133
A782: -0.1 | B782: 0.45 | C782: 66167
A783: -0.09 | B783: 0.44 | C783: 66200
A784: -0.09 | B784: 0.44 | C784: 66233
A785: -0.09 | B785: 0.44 | C785: 66267
A786: -0.09 | B786: 0.44 | C786: 66300
A787: -0.09 | B787: 0.45 | C787: 66333
A788: -0.09 | B788: 0.45 | C788: 66367
A789: -0.09 | B789: 0.45 | C789: 66400
A790: -0.09 | B790: 0.45 | C790: 66433
A791: -0.09 | B791: 0.45 | C791: 66467
A792: -7.0000000000000007E-2 | B792: 0.44 | C792: 66500
A793: -7.0000000000000007E-2 | B793: 0.44 | C793: 66533
A794: -7.0000000000000007E-2 | B794: 0.44 | C794: 66567
A795: -7.0000000000000007E-2 | B795: 0.45 | C795: 66600
A796: -7.0000000000000007E-2 | B796: 0.45 | C796: 66633
A797: -7.0000000000000007E-2 | B797: 0.45 | C797: 66667
A798: -7.0000000000000007E-2 | B798: 0.45 | C798: 66700
A799: -0.06 | B799: 0.44 | C799: 66733
A800: -0.06 | B800: 0.44 | C800: 66767
A801: -0.06 | B801: 0.44 | C801: 66800
A802: -0.06 | B802: 0.45 | C802: 66833
A803: -0.06 | B803: 0.45 | C803: 66867
A804: -0.06 | B804: 0.45 | C804: 66900
A805: -0.06 | B805: 0.45 | C805: 66933
A806: -0.06 | B806: 0.45 | C806: 66967
A807: -0.06 | B807: 0.46 | C807: 67000
A808: -0.04 | B808: 0.45 | C808: 67033
A809: -0.04 | B809: 0.45 | C809: 67067
A810: -0.04 | B810: 0.46 | C810: 67100
A811: -0.04 | B811: 0.46 | C811: 67133
A812: -0.03 | B812: 0.45 | C812: 67167
A813: -0.03 | B813: 0.45 | C813: 67200
A814: -0.03 | B814: 0.46 | C814: 67233
A815: -0.03 | B815: 0.46 | C815: 67267
A816: -0.03 | B816: 0.46 | C816: 67300
A817: -0.02 | B817: 0.45 | C817: 67333
A818: -0.02 | B818: 0.45 | C818: 67367
A819: -0.02 | B819: 0.46 | C819: 67400
A820: -0.02 | B820: 0.46 | C820: 67433
A821: 0 | B821: 0.45 | C821: 67467
A822: 0 | B822: 0.45 | C822: 67500
A823: 0 | B823: 0.46 | C823: 67533
A824: 0 | B824: 0.46 | C824: 67567
A825: 0 | B825: 0.48 | C825: 67600
A826: 0 | B826: 0.48 | C826: 67633
A827: 0.01 | B827: 0.46 | C827: 67667
A828: 0.01 | B828: 0.48 | C828: 67700
A829: 0.01 | B829: 0.48 | C829: 67733
A830: 0.02 | B830: 0.46 | C830: 67767
A831: 0.02 | B831: 0.48 | C831: 67800
A832: 0.04 | B832: 0.46 | C832: 67833
A833: 0.04 | B833: 0.48 | C833: 67867
A834: 0.04 | B834: 0.48 | C834: 67900
A835: 0.05 | B835: 0.46 | C835: 67933
A836: 0.05 | B836: 0.48 | C836: 67967
A837: 0.05 | B837: 0.48 | C837: 68000
A838: 0.05 | B838: 0.49 | C838: 68033
A839: 0.06 | B839: 0.48 | C839: 68067
A840: 0.06 | B840: 0.48 | C840: 68100
A841: 0.06 | B841: 0.49 | C841: 68133
A842: 0.08 | B842: 0.48 | C842: 68167
A843: 0.08 | B843: 0.49 | C843: 68200
A844: 0.09 | B844: 0.48 | C844: 68233
A845: 0.09 | B845: 0.49 | C845: 68267
A846: 0.1 | B846: 0.48 | C846: 68300
A847: 0.1 | B847: 0.49 | C847: 68333
A848: 0.1 | B848: 0.5 | C848: 68367
A849: 0.12 | B849: 0.49 | C849: 68400
A850: 0.12 | B850: 0.5 | C850: 68433
A851: 0.13 | B851: 0.49 | C851: 68467
A852: 0.13 | B852: 0.5 | C852: 68500
A853: 0.13 | B853: 0.5 | C853: 68533
A854: 0.14000000000000001 | B854: 0.5 | C854: 68567
A855: 0.14000000000000001 | B855: 0.5 | C855: 68600
A856: 0.16 | B856: 0.5 | C856: 68633
A857: 0.16 | B857: 0.5 | C857: 68667
A858: 0.17 | B858: 0.5 | C858: 68700
A859: 0.17 | B859: 0.52 | C859: 68733
A860: 0.18 | B860: 0.5 | C860: 68767
A861: 0.18 | B861: 0.5 | C861: 68800
A862: 0.18 | B862: 0.52 | C862: 68833
A863: 0.18 | B863: 0.52 | C863: 68867
A864: 0.18 | B864: 0.53 | C864: 68900
A865: 0.2 | B865: 0.52 | C865: 68933
A866: 0.2 | B866: 0.53 | C866: 68967
A867: 0.21 | B867: 0.52 | C867: 69000
A868: 0.21 | B868: 0.53 | C868: 69033
A869: 0.21 | B869: 0.53 | C869: 69067
A870: 0.23 | B870: 0.53 | C870: 69100
A871: 0.23 | B871: 0.53 | C871: 69133
A872: 0.24 | B872: 0.53 | C872: 69167
A873: 0.24 | B873: 0.55000000000000004 | C873: 69200
A874: 0.25 | B874: 0.53 | C874: 69233
A875: 0.25 | B875: 0.55000000000000004 | C875: 69267
A876: 0.27 | B876: 0.53 | C876: 69300
A877: 0.27 | B877: 0.53 | C877: 69333
A878: 0.27 | B878: 0.55000000000000004 | C878: 69367
A879: 0.27 | B879: 0.56000000000000005 | C879: 69400
A880: 0.28000000000000003 | B880: 0.55000000000000004 | C880: 69433
A881: 0.28999999999999998 | B881: 0.55000000000000004 | C881: 69467
A882: 0.28999999999999998 | B882: 0.56000000000000005 | C882: 69500
A883: 0.28999999999999998 | B883: 0.56000000000000005 | C883: 69533
A884: 0.31 | B884: 0.56000000000000005 | C884: 69567
A885: 0.32 | B885: 0.56000000000000005 | C885: 69600
A886: 0.32 | B886: 0.56999999999999995 | C886: 69633
A887: 0.33 | B887: 0.56000000000000005 | C887: 69667
A888: 0.33 | B888: 0.56999999999999995 | C888: 69700
A889: 0.35 | B889: 0.56999999999999995 | C889: 69733
A890: 0.35 | B890: 0.56999999999999995 | C890: 69767
A891: 0.36 | B891: 0.56999999999999995 | C891: 69800
A892: 0.36 | B892: 0.59 | C892: 69833
A893: 0.37 | B893: 0.59 | C893: 69867
A894: 0.37 | B894: 0.59 | C894: 69900
A895: 0.39 | B895: 0.59 | C895: 69933
A896: 0.4 | B896: 0.59 | C896: 69967
A897: 0.4 | B897: 0.6 | C897: 70000
A898: 0.41 | B898: 0.6 | C898: 70033
A899: 0.43 | B899: 0.6 | C899: 70067
A900: 0.43 | B900: 0.61 | C900: 70100
A901: 0.43 | B901: 0.61 | C901: 70133
A902: 0.44 | B902: 0.61 | C902: 70167
A903: 0.45 | B903: 0.61 | C903: 70200
A904: 0.47 | B904: 0.61 | C904: 70233
A905: 0.48 | B905: 0.61 | C905: 70267
A906: 0.49 | B906: 0.61 | C906: 70300
A907: 0.51 | B907: 0.61 | C907: 70333
A908: 0.51 | B908: 0.63 | C908: 70367
A909: 0.52 | B909: 0.63 | C909: 70400
A910: 0.53 | B910: 0.63 | C910: 70433
A911: 0.53 | B911: 0.64 | C911: 70467
A912: 0.55000000000000004 | B912: 0.64 | C912: 70500
A913: 0.56000000000000005 | B913: 0.64 | C913: 70533
A914: 0.56000000000000005 | B914: 0.65 | C914: 70567
A915: 0.56999999999999995 | B915: 0.65 | C915: 70600
A916: 0.57999999999999996 | B916: 0.65 | C916: 70633
A917: 0.59 | B917: 0.65 | C917: 70667
A918: 0.6 | B918: 0.64 | C918: 70700
A919: 0.6 | B919: 0.65 | C919: 70733
A920: 0.62 | B920: 0.65 | C920: 70767
A921: 0.62 | B921: 0.67 | C921: 70800
A922: 0.63 | B922: 0.65 | C922: 70833
A923: 0.63 | B923: 0.67 | C923: 70867
A924: 0.64 | B924: 0.65 | C924: 70900
A925: 0.64 | B925: 0.67 | C925: 70933
A926: 0.64 | B926: 0.67 | C926: 70967
A927: 0.66 | B927: 0.67 | C927: 71000
A928: 0.66 | B928: 0.68 | C928: 71033
A929: 0.66 | B929: 0.68 | C929: 71067
A930: 0.67 | B930: 0.68 | C930: 71100
A931: 0.67 | B931: 0.69 | C931: 71133
A932: 0.68 | B932: 0.68 | C932: 71167
A933: 0.68 | B933: 0.69 | C933: 71200
A934: 0.7 | B934: 0.68 | C934: 71233
A935: 0.7 | B935: 0.69 | C935: 71267
A936: 0.7 | B936: 0.71 | C936: 71300
A937: 0.7 | B937: 0.71 | C937: 71333
A938: 0.71 | B938: 0.69 | C938: 71367
A939: 0.71 | B939: 0.69 | C939: 71400
A940: 0.71 | B940: 0.71 | C940: 71433
A941: 0.71 | B941: 0.71 | C941: 71467
A942: 0.72 | B942: 0.71 | C942: 71500
A943: 0.72 | B943: 0.71 | C943: 71533
A944: 0.74 | B944: 0.71 | C944: 71567
A945: 0.74 | B945: 0.71 | C945: 71600
A946: 0.75 | B946: 0.71 | C946: 71633
A947: 0.75 | B947: 0.72 | C947: 71667
A948: 0.75 | B948: 0.72 | C948: 71700
A949: 0.76 | B949: 0.72 | C949: 71733
A950: 0.76 | B950: 0.72 | C950: 71767
A951: 0.78 | B951: 0.72 | C951: 71800
A952: 0.78 | B952: 0.72 | C952: 71833
A953: 0.78 | B953: 0.73 | C953: 71867
A954: 0.78 | B954: 0.73 | C954: 71900
A955: 0.79 | B955: 0.73 | C955: 71933
A956: 0.8 | B956: 0.73 | C956: 71967
A957: 0.8 | B957: 0.73 | C957: 72000
A958: 0.8 | B958: 0.75 | C958: 72033
A959: 0.82 | B959: 0.75 | C959: 72067
A960: 0.83 | B960: 0.75 | C960: 72100
A961: 0.83 | B961: 0.76 | C961: 72133
A962: 0.83 | B962: 0.76 | C962: 72167
A963: 0.84 | B963: 0.76 | C963: 72200
A964: 0.86 | B964: 0.76 | C964: 72233
A965: 0.86 | B965: 0.76 | C965: 72267
A966: 0.86 | B966: 0.77 | C966: 72300
A967: 0.87 | B967: 0.77 | C967: 72333
A968: 0.87 | B968: 0.77 | C968: 72367
A969: 0.87 | B969: 0.79 | C969: 72400
A970: 0.88 | B970: 0.79 | C970: 72433
A971: 0.9 | B971: 0.79 | C971: 72467
A972: 0.91 | B972: 0.79 | C972: 72500
A973: 0.91 | B973: 0.79 | C973: 72533
A974: 0.91 | B974: 0.8 | C974: 72567
A975: 0.92 | B975: 0.8 | C975: 72600
A976: 0.92 | B976: 0.81 | C976: 72633
A977: 0.94 | B977: 0.81 | C977: 72667
A978: 0.95 | B978: 0.81 | C978: 72700
A979: 0.95 | B979: 0.83 | C979: 72733
A980: 0.96 | B980: 0.83 | C980: 72767
A981: 0.96 | B981: 0.84 | C981: 72800
A982: 0.98 | B982: 0.84 | C982: 72833
A983: 1 | B983: 0.84 | C983: 72867
A984: 1 | B984: 0.85 | C984: 72900
A985: 1.02 | B985: 0.86 | C985: 72933
A986: 1.02 | B986: 0.87 | C986: 72967
A987: 1.04 | B987: 0.87 | C987: 73000
A988: 1.04 | B988: 0.87 | C988: 73033
A989: 1.06 | B989: 0.88 | C989: 73067
A990: 1.07 | B990: 0.88 | C990: 73100
A991: 1.07 | B991: 0.9 | C991: 73133
A992: 1.08 | B992: 0.89 | C992: 73167
A993: 1.1000000000000001 | B993: 0.9 | C993: 73200
A994: 1.1000000000000001 | B994: 0.91 | C994: 73233
A995: 1.1100000000000001 | B995: 0.91 | C995: 73267
A996: 1.1100000000000001 | B996: 0.92 | C996: 73300
A997: 1.1200000000000001 | B997: 0.92 | C997: 73333
A998: 1.1499999999999999 | B998: 0.92 | C998: 73367
A999: 1.1499999999999999 | B999: 0.94 | C999: 73400
A1000: 1.1499999999999999 | B1000: 0.94 | C1000: 73433
A1001: 1.1499999999999999 | B1001: 0.95 | C1001: 73467
A1002: 1.18 | B1002: 0.95 | C1002: 73500
A1003: 1.18 | B1003: 0.95 | C1003: 73533
A1004: 1.18 | B1004: 0.96 | C1004: 73567
A1005: 1.19 | B1005: 0.96 | C1005: 73600
A1006: 1.19 | B1006: 0.98 | C1006: 73633
A1007: 1.2 | B1007: 0.98 | C1007: 73667
A1008: 1.2 | B1008: 0.99 | C1008: 73700
A1009: 1.22 | B1009: 0.99 | C1009: 73733
A1010: 1.23 | B1010: 0.99 | C1010: 73767
A1011: 1.23 | B1011: 1 | C1011: 73800
A1012: 1.24 | B1012: 1 | C1012: 73833
A1013: 1.23 | B1013: 1.02 | C1013: 73867
A1014: 1.24 | B1014: 1.02 | C1014: 73900
A1015: 1.26 | B1015: 1.02 | C1015: 73933
A1016: 1.27 | B1016: 1.02 | C1016: 73967
A1017: 1.26 | B1017: 1.03 | C1017: 74000
A1018: 1.27 | B1018: 1.03 | C1018: 74033
A1019: 1.29 | B1019: 1.03 | C1019: 74067
A1020: 1.29 | B1020: 1.04 | C1020: 74100
A1021: 1.3 | B1021: 1.04 | C1021: 74133
A1022: 1.3 | B1022: 1.06 | C1022: 74167
A1023: 1.31 | B1023: 1.06 | C1023: 74200
A1024: 1.31 | B1024: 1.07 | C1024: 74233
A1025: 1.34 | B1025: 1.07 | C1025: 74267
A1026: 1.34 | B1026: 1.08 | C1026: 74300
A1027: 1.35 | B1027: 1.08 | C1027: 74333
A1028: 1.35 | B1028: 1.1000000000000001 | C1028: 74367
A1029: 1.38 | B1029: 1.1000000000000001 | C1029: 74400
A1030: 1.38 | B1030: 1.1100000000000001 | C1030: 74433
A1031: 1.38 | B1031: 1.1200000000000001 | C1031: 74467
A1032: 1.41 | B1032: 1.1200000000000001 | C1032: 74500
A1033: 1.41 | B1033: 1.1399999999999999 | C1033: 74533
A1034: 1.43 | B1034: 1.1399999999999999 | C1034: 74567
A1035: 1.43 | B1035: 1.1499999999999999 | C1035: 74600
A1036: 1.45 | B1036: 1.1499999999999999 | C1036: 74633
A1037: 1.46 | B1037: 1.17 | C1037: 74667
A1038: 1.47 | B1038: 1.17 | C1038: 74700
A1039: 1.47 | B1039: 1.18 | C1039: 74733
A1040: 1.49 | B1040: 1.18 | C1040: 74767
A1041: 1.49 | B1041: 1.19 | C1041: 74800
A1042: 1.5 | B1042: 1.19 | C1042: 74833
A1043: 1.5 | B1043: 1.21 | C1043: 74867
A1044: 1.51 | B1044: 1.21 | C1044: 74900
A1045: 1.51 | B1045: 1.22 | C1045: 74933
A1046: 1.53 | B1046: 1.22 | C1046: 74967
A1047: 1.53 | B1047: 1.23 | C1047: 75000
A1048: 1.55 | B1048: 1.23 | C1048: 75033
A1049: 1.55 | B1049: 1.25 | C1049: 75067
A1050: 1.55 | B1050: 1.26 | C1050: 75100
A1051: 1.57 | B1051: 1.26 | C1051: 75133
A1052: 1.59 | B1052: 1.26 | C1052: 75167
A1053: 1.59 | B1053: 1.27 | C1053: 75200
A1054: 1.61 | B1054: 1.29 | C1054: 75233
A1055: 1.61 | B1055: 1.3 | C1055: 75267
A1056: 1.63 | B1056: 1.3 | C1056: 75300
A1057: 1.63 | B1057: 1.31 | C1057: 75333
A1058: 1.64 | B1058: 1.34 | C1058: 75367
A1059: 1.64 | B1059: 1.35 | C1059: 75400
A1060: 1.64 | B1060: 1.36 | C1060: 75433
A1061: 1.67 | B1061: 1.36 | C1061: 75467
A1062: 1.67 | B1062: 1.38 | C1062: 75500
A1063: 1.67 | B1063: 1.39 | C1063: 75533
A1064: 1.66 | B1064: 1.4 | C1064: 75567
A1065: 1.68 | B1065: 1.4 | C1065: 75600
A1066: 1.68 | B1066: 1.42 | C1066: 75633
A1067: 1.67 | B1067: 1.43 | C1067: 75667
A1068: 1.71 | B1068: 1.43 | C1068: 75700
A1069: 1.7 | B1069: 1.44 | C1069: 75733
A1070: 1.72 | B1070: 1.44 | C1070: 75767
A1071: 1.72 | B1071: 1.46 | C1071: 75800
A1072: 1.75 | B1072: 1.46 | C1072: 75833
A1073: 1.78 | B1073: 1.46 | C1073: 75867
A1074: 1.78 | B1074: 1.47 | C1074: 75900
A1075: 1.81 | B1075: 1.47 | C1075: 75933